[
  {
    "candidate_id": "example-b",
    "shape": "box",
    "parameters": {
      "period_days": 3.36,
      "epoch_btjd": 1387.06,
      "duration_hours": 1.6,
      "depth_ppm": 1450.0
    },
    "baseline": {
      "kind": "unity"
    },
    "residual_model_version": "box-divide-v0"
  },
  {
    "candidate_id": "example-c",
    "shape": "box",
    "parameters": {
      "period_days": 5.66,
      "epoch_btjd": 1387.1,
      "duration_hours": 2.1,
      "depth_ppm": 2100.0
    },
    "baseline": {
      "kind": "unity"
    },
    "residual_model_version": "box-divide-v0"
  }
]